{
  "version": "generated-2026-05-30",
  "lastUpdated": "2026-05-30T22:41:56.772Z",
  "generatedFrom": "DataCloudRouterBuilder.java + RouteSecurityRegistry.java",
  "routes": [
    {
      "method": "DELETE",
      "path": "/api/v1/action/memory/{agentId}/{memoryId}",
      "sensitivity": "CRITICAL",
      "requiresAuth": true,
      "requiresTenant": true,
      "requiresPolicy": true,
      "requiresBlockingAudit": true,
      "requiredAccess": "ADMIN",
      "idempotent": true,
      "description": "DELETE /api/v1/action/memory/{agentId}/{memoryId}",
      "legacyStatus": "active",
      "runtimeTruthSurface": "VISIBLE",
      "category": "Action Plane"
    },
    {
      "method": "DELETE",
      "path": "/api/v1/action/pipelines/{pipelineId}",
      "sensitivity": "CRITICAL",
      "requiresAuth": true,
      "requiresTenant": true,
      "requiresPolicy": true,
      "requiresBlockingAudit": true,
      "requiredAccess": "ADMIN",
      "idempotent": true,
      "description": "DELETE /api/v1/action/pipelines/{pipelineId}",
      "legacyStatus": "active",
      "runtimeTruthSurface": "VISIBLE",
      "category": "Action Plane"
    },
    {
      "method": "GET",
      "path": "/api/v1/action/agents/catalog",
      "sensitivity": "INTERNAL",
      "requiresAuth": true,
      "requiresTenant": true,
      "requiresPolicy": false,
      "requiresBlockingAudit": false,
      "requiredAccess": "VIEWER",
      "idempotent": true,
      "description": "GET /api/v1/action/agents/catalog",
      "legacyStatus": "active",
      "runtimeTruthSurface": "VISIBLE",
      "category": "Action Plane"
    },
    {
      "method": "GET",
      "path": "/api/v1/action/agents/catalog/{id}",
      "sensitivity": "INTERNAL",
      "requiresAuth": true,
      "requiresTenant": true,
      "requiresPolicy": false,
      "requiresBlockingAudit": false,
      "requiredAccess": "VIEWER",
      "idempotent": true,
      "description": "GET /api/v1/action/agents/catalog/{id}",
      "legacyStatus": "active",
      "runtimeTruthSurface": "VISIBLE",
      "category": "Action Plane"
    },
    {
      "method": "GET",
      "path": "/api/v1/action/autonomy/domains",
      "sensitivity": "SENSITIVE",
      "requiresAuth": true,
      "requiresTenant": true,
      "requiresPolicy": false,
      "requiresBlockingAudit": false,
      "requiredAccess": "ADMIN",
      "idempotent": true,
      "description": "GET /api/v1/action/autonomy/domains",
      "legacyStatus": "active",
      "runtimeTruthSurface": "VISIBLE",
      "category": "Action Plane"
    },
    {
      "method": "GET",
      "path": "/api/v1/action/autonomy/domains/{domain}",
      "sensitivity": "SENSITIVE",
      "requiresAuth": true,
      "requiresTenant": true,
      "requiresPolicy": false,
      "requiresBlockingAudit": false,
      "requiredAccess": "ADMIN",
      "idempotent": true,
      "description": "GET /api/v1/action/autonomy/domains/{domain}",
      "legacyStatus": "active",
      "runtimeTruthSurface": "VISIBLE",
      "category": "Action Plane"
    },
    {
      "method": "GET",
      "path": "/api/v1/action/autonomy/level",
      "sensitivity": "SENSITIVE",
      "requiresAuth": true,
      "requiresTenant": true,
      "requiresPolicy": false,
      "requiresBlockingAudit": false,
      "requiredAccess": "ADMIN",
      "idempotent": true,
      "description": "GET /api/v1/action/autonomy/level",
      "legacyStatus": "active",
      "runtimeTruthSurface": "VISIBLE",
      "category": "Action Plane"
    },
    {
      "method": "GET",
      "path": "/api/v1/action/autonomy/logs",
      "sensitivity": "SENSITIVE",
      "requiresAuth": true,
      "requiresTenant": true,
      "requiresPolicy": false,
      "requiresBlockingAudit": false,
      "requiredAccess": "ADMIN",
      "idempotent": true,
      "description": "GET /api/v1/action/autonomy/logs",
      "legacyStatus": "active",
      "runtimeTruthSurface": "VISIBLE",
      "category": "Action Plane"
    },
    {
      "method": "GET",
      "path": "/api/v1/action/autonomy/plan/{actionType}",
      "sensitivity": "SENSITIVE",
      "requiresAuth": true,
      "requiresTenant": true,
      "requiresPolicy": false,
      "requiresBlockingAudit": false,
      "requiredAccess": "ADMIN",
      "idempotent": true,
      "description": "GET /api/v1/action/autonomy/plan/{actionType}",
      "legacyStatus": "active",
      "runtimeTruthSurface": "VISIBLE",
      "category": "Action Plane"
    },
    {
      "method": "GET",
      "path": "/api/v1/action/executions/{executionId}",
      "sensitivity": "INTERNAL",
      "requiresAuth": true,
      "requiresTenant": true,
      "requiresPolicy": false,
      "requiresBlockingAudit": false,
      "requiredAccess": "VIEWER",
      "idempotent": true,
      "description": "GET /api/v1/action/executions/{executionId}",
      "legacyStatus": "active",
      "runtimeTruthSurface": "VISIBLE",
      "category": "Action Plane"
    },
    {
      "method": "GET",
      "path": "/api/v1/action/executions/{executionId}/checkpoints",
      "sensitivity": "INTERNAL",
      "requiresAuth": true,
      "requiresTenant": true,
      "requiresPolicy": false,
      "requiresBlockingAudit": false,
      "requiredAccess": "VIEWER",
      "idempotent": true,
      "description": "GET /api/v1/action/executions/{executionId}/checkpoints",
      "legacyStatus": "active",
      "runtimeTruthSurface": "VISIBLE",
      "category": "Action Plane"
    },
    {
      "method": "GET",
      "path": "/api/v1/action/executions/{executionId}/logs",
      "sensitivity": "INTERNAL",
      "requiresAuth": true,
      "requiresTenant": true,
      "requiresPolicy": false,
      "requiresBlockingAudit": false,
      "requiredAccess": "VIEWER",
      "idempotent": true,
      "description": "GET /api/v1/action/executions/{executionId}/logs",
      "legacyStatus": "active",
      "runtimeTruthSurface": "VISIBLE",
      "category": "Action Plane"
    },
    {
      "method": "GET",
      "path": "/api/v1/action/learning/review",
      "sensitivity": "INTERNAL",
      "requiresAuth": true,
      "requiresTenant": true,
      "requiresPolicy": false,
      "requiresBlockingAudit": false,
      "requiredAccess": "VIEWER",
      "idempotent": true,
      "description": "GET /api/v1/action/learning/review",
      "legacyStatus": "active",
      "runtimeTruthSurface": "VISIBLE",
      "category": "Action Plane"
    },
    {
      "method": "GET",
      "path": "/api/v1/action/learning/status",
      "sensitivity": "INTERNAL",
      "requiresAuth": true,
      "requiresTenant": true,
      "requiresPolicy": false,
      "requiresBlockingAudit": false,
      "requiredAccess": "VIEWER",
      "idempotent": true,
      "description": "GET /api/v1/action/learning/status",
      "legacyStatus": "active",
      "runtimeTruthSurface": "VISIBLE",
      "category": "Action Plane"
    },
    {
      "method": "GET",
      "path": "/api/v1/action/memory",
      "sensitivity": "SENSITIVE",
      "requiresAuth": true,
      "requiresTenant": true,
      "requiresPolicy": false,
      "requiresBlockingAudit": false,
      "requiredAccess": "OPERATOR",
      "idempotent": true,
      "description": "GET /api/v1/action/memory",
      "legacyStatus": "active",
      "runtimeTruthSurface": "VISIBLE",
      "category": "Action Plane"
    },
    {
      "method": "GET",
      "path": "/api/v1/action/memory/{agentId}",
      "sensitivity": "SENSITIVE",
      "requiresAuth": true,
      "requiresTenant": true,
      "requiresPolicy": false,
      "requiresBlockingAudit": false,
      "requiredAccess": "OPERATOR",
      "idempotent": true,
      "description": "GET /api/v1/action/memory/{agentId}",
      "legacyStatus": "active",
      "runtimeTruthSurface": "VISIBLE",
      "category": "Action Plane"
    },
    {
      "method": "GET",
      "path": "/api/v1/action/memory/{agentId}/{tier}",
      "sensitivity": "SENSITIVE",
      "requiresAuth": true,
      "requiresTenant": true,
      "requiresPolicy": false,
      "requiresBlockingAudit": false,
      "requiredAccess": "OPERATOR",
      "idempotent": true,
      "description": "GET /api/v1/action/memory/{agentId}/{tier}",
      "legacyStatus": "active",
      "runtimeTruthSurface": "VISIBLE",
      "category": "Action Plane"
    },
    {
      "method": "GET",
      "path": "/api/v1/action/pipelines",
      "sensitivity": "INTERNAL",
      "requiresAuth": true,
      "requiresTenant": true,
      "requiresPolicy": false,
      "requiresBlockingAudit": false,
      "requiredAccess": "VIEWER",
      "idempotent": true,
      "description": "GET /api/v1/action/pipelines",
      "legacyStatus": "active",
      "runtimeTruthSurface": "VISIBLE",
      "category": "Action Plane"
    },
    {
      "method": "GET",
      "path": "/api/v1/action/pipelines/{pipelineId}",
      "sensitivity": "INTERNAL",
      "requiresAuth": true,
      "requiresTenant": true,
      "requiresPolicy": false,
      "requiresBlockingAudit": false,
      "requiredAccess": "VIEWER",
      "idempotent": true,
      "description": "GET /api/v1/action/pipelines/{pipelineId}",
      "legacyStatus": "active",
      "runtimeTruthSurface": "VISIBLE",
      "category": "Action Plane"
    },
    {
      "method": "GET",
      "path": "/api/v1/action/pipelines/{pipelineId}/executions",
      "sensitivity": "INTERNAL",
      "requiresAuth": true,
      "requiresTenant": true,
      "requiresPolicy": false,
      "requiresBlockingAudit": false,
      "requiredAccess": "VIEWER",
      "idempotent": true,
      "description": "GET /api/v1/action/pipelines/{pipelineId}/executions",
      "legacyStatus": "active",
      "runtimeTruthSurface": "VISIBLE",
      "category": "Action Plane"
    },
    {
      "method": "GET",
      "path": "/api/v1/action/pipelines/{pipelineId}/executions/{executionId}",
      "sensitivity": "INTERNAL",
      "requiresAuth": true,
      "requiresTenant": true,
      "requiresPolicy": false,